"ID","feature","chr","source","type","start","end","score","strand","phase","attributes","Alias","full_name","Note","symbol","curator_summary","chr_num","qtl","avg_snp_betas_sq","avg_snp_pve","score","left_bound","right_bound","chr","left_pos","right_pos"
"AT4G21680",554208,"Chr4","Araport11","gene",11517353,11519805,".","-",".","ID=AT4G21680;Name=AT4G21680;Note=NITRATE TRANSPORTER 1.8;curator_summary=Encodes a nitrate transporter (NRT1.8).  Functions in nitrate removal from the xylem sap. Mediates cadmium tolerance.;symbol=NRT1.8;Alias=AtNPF7.2,NPF7.2,NRT1/ PTR family 7.2;full_name=NITRATE TRANSPORTER 1.8;computational_description=NITRATE TRANSPORTER 1.8 (NRT1.8)%3B FUNCTIONS IN: transporter activity%2C nitrate transmembrane transporter activity%3B INVOLVED IN: response to cadmium ion%2C oligopeptide transport%2C response to nitrate%3B LOCATED IN: plasma membrane%2C membrane%3B EXPRESSED IN: 9 plant structures%3B EXPRESSED DURING: LP.04 four leaves visible%2C 4 anthesis%2C petal differentiation and expansion stage%3B CONTAINS InterPro DOMAIN/s: Oligopeptide transporter (InterPro:IPR000109)%2C Major facilitator superfamily%2C general substrate transporter (InterPro:IPR016196)%3B BEST Arabidopsis thaliana protein match is: nitrate transporter 1.5 (TAIR:AT1G32450.1)%3B Has 7448 Blast hits to 7020 proteins in 1418 species: Archae - 0%3B Bacteria - 3502%3B Metazoa - 786%3B Fungi - 405%3B Plants - 2210%3B Viruses - 0%3B Other Eukaryotes - 545 (source: NCBI BLink).;Dbxref=PMID:15539473,PMID:16307366,PMID:17172353,PMID:17304219,PMID:18783601,PMID:20501909,PMID:20837581,PMID:22685171,PMID:25326291,locus:2119058;locus_type=protein_coding","AtNPF7.2,NPF7.2,NRT1/ PTR family 7.2","NITRATE TRANSPORTER 1.8","NITRATE TRANSPORTER 1.8","NRT1.8","Encodes a nitrate transporter (NRT1.8).  Functions in nitrate removal from the xylem sap. Mediates cadmium tolerance.",4,"m_4_11631139",0.0273593045059114,0.0239373212467941,3.82665008178059,"m_4_11123050","m_4_11979842",4,11123050,11979842
"AT4G22190",555749,"Chr4","Araport11","gene",11741780,11743318,".","-",".","ID=AT4G22190;Name=AT4G22190;Note=serine/arginine repetitive matrix-like protein;computational_description=unknown protein%3B Has 283 Blast hits to 154 proteins in 44 species: Archae - 0%3B Bacteria - 2%3B Metazoa - 24%3B Fungi - 12%3B Plants - 48%3B Viruses - 0%3B Other Eukaryotes - 197 (source: NCBI BLink).;Dbxref=PMID:14576160,PMID:17259181,PMID:24023856,locus:2132050;locus_type=protein_coding","","","serine/arginine repetitive matrix-like protein","","",4,"m_4_11631139",0.0273593045059114,0.0239373212467941,3.82665008178059,"m_4_11123050","m_4_11979842",4,11123050,11979842
"AT4G22200",555756,"Chr4","Araport11","gene",11746490,11750698,".","-",".","ID=AT4G22200;Name=AT4G22200;Note=potassium transport 2/3;curator_summary=Encodes AKT2%2C a photosynthate- and light-dependent inward rectifying potassium channel with unique gating properties that are regulated by phosphorylation.  Expressed in guard cell protoplasts and in the phloem and xylem of aerial portions of the plant.  The channel can coassemble with another K+ channel%2C KAT1%2C in vitro.  In guard cells%2C AKT2/3 is responsible for the Ca2+ sensitivity of the K+ uptake channel.  In the phloem%2C it regulates the sucrose/H+ symporters via the phloem potential.  AKT2 belongs to the Shaker family K+ channels which include the following groups based on phylogenetic analysis (FEBS Letters (2007) 581: 2357): I (inward rectifying channel): AKT1 (AT2G26650)%2C AKT5 (AT4G32500) and SPIK (also known as AKT6%2C AT2G25600)%3B II (inward rectifying channel): KAT1 (AT5G46240) and KAT2 (AT4G18290)%3B III (weakly inward rectifying channel): AKT2 (AT4G22200)%3B IV (regulatory subunit involved in inwardly rectifying conductance formation): KAT3 (also known as AtKC1%2C AT4G32650)%3B V (outward rectifying channel): SKOR (AT3G02850) and GORK (AT5G37500).;symbol=KT2/3;Alias=AKT2,AKT2/3,potassium transport 2/3,AKT3;full_name=potassium transport 2/3;computational_description=potassium transport 2/3 (KT2/3)%3B FUNCTIONS IN: inward rectifier potassium channel activity%2C protein binding%2C cyclic nucleotide binding%3B INVOLVED IN: regulation of membrane potential%2C response to abscisic acid stimulus%3B LOCATED IN: membrane%3B EXPRESSED IN: 24 plant structures%3B EXPRESSED DURING: 13 growth stages%3B CONTAINS InterPro DOMAIN/s: Cyclic nucleotide-binding (InterPro:IPR000595)%2C Potassium channel%2C voltage-dependent%2C EAG/ELK/ERG (InterPro:IPR003938)%2C Protein of unknown function DUF3354 (InterPro:IPR021789)%2C Ankyrin repeat-containing domain (InterPro:IPR020683)%2C Ion transport (InterPro:IPR005821)%2C Cyclic nucleotide-binding-like (InterPro:IPR018490)%2C RmlC-like jelly roll fold (InterPro:IPR014710)%2C Ankyrin repeat (InterPro:IPR002110)%3B BEST Arabidopsis thaliana protein match is: K+ transporter 1 (TAIR:AT2G26650.1)%3B Has 30201 Blast hits to 17322 proteins in 780 species: Archae - 12%3B Bacteria - 1396%3B Metazoa - 17338%3B Fungi - 3422%3B Plants - 5037%3B Viruses - 0%3B Other Eukaryotes - 2996 (source: NCBI BLink).;Dbxref=PMID:10929122,PMID:10852932,PMID:10377458,PMID:9916143,PMID:9707551,PMID:8549795,PMID:8552711,PMID:11706182,PMID:11226341,PMID:11181729,PMID:12172027,PMID:12034902,PMID:12447548,PMID:12678562,PMID:12795698,PMID:14675456,PMID:15299147,PMID:15824192,PMID:16316977,PMID:16297070,PMID:16968880,PMID:17146665,PMID:18650403,PMID:19748453,PMID:21187374,PMID:21445098,PMID:21445013,PMID:21518051,locus:2132065;locus_type=protein_coding","AKT2,AKT2/3,potassium transport 2/3,AKT3","potassium transport 2/3","potassium transport 2/3","KT2/3","Encodes AKT2%2C a photosynthate- and light-dependent inward rectifying potassium channel with unique gating properties that are regulated by phosphorylation.  Expressed in guard cell protoplasts and in the phloem and xylem of aerial portions of the plant.  The channel can coassemble with another K+ channel%2C KAT1%2C in vitro.  In guard cells%2C AKT2/3 is responsible for the Ca2+ sensitivity of the K+ uptake channel.  In the phloem%2C it regulates the sucrose/H+ symporters via the phloem potential.  AKT2 belongs to the Shaker family K+ channels which include the following groups based on phylogenetic analysis (FEBS Letters (2007) 581: 2357): I (inward rectifying channel): AKT1 (AT2G26650)%2C AKT5 (AT4G32500) and SPIK (also known as AKT6%2C AT2G25600)%3B II (inward rectifying channel): KAT1 (AT5G46240) and KAT2 (AT4G18290)%3B III (weakly inward rectifying channel): AKT2 (AT4G22200)%3B IV (regulatory subunit involved in inwardly rectifying conductance formation): KAT3 (also known as AtKC1%2C AT4G32650)%3B V (outward rectifying channel): SKOR (AT3G02850) and GORK (AT5G37500).",4,"m_4_11631139",0.0273593045059114,0.0239373212467941,3.82665008178059,"m_4_11123050","m_4_11979842",4,11123050,11979842
"AT4G22470",556473,"Chr4","Araport11","gene",11840134,11841450,".","-",".","ID=AT4G22470;Name=AT4G22470;Note=protease inhibitor/seed storage/lipid transfer protein (LTP) family protein;computational_description=protease inhibitor/seed storage/lipid transfer protein (LTP) family protein%3B FUNCTIONS IN: lipid binding%3B INVOLVED IN: lipid transport%3B LOCATED IN: endomembrane system%3B EXPRESSED IN: embryo%2C hypocotyl%2C sepal%2C stamen%3B EXPRESSED DURING: 4 anthesis%2C C globular stage%2C petal differentiation and expansion stage%3B CONTAINS InterPro DOMAIN/s: Bifunctional inhibitor/plant lipid transfer protein/seed storage (InterPro:IPR016140)%2C Plant lipid transfer protein/hydrophobic protein%2C helical domain (InterPro:IPR013770)%3B BEST Arabidopsis thaliana protein match is: Bifunctional inhibitor/lipid-transfer protein/seed storage 2S albumin superfamily protein (TAIR:AT4G22485.1)%3B Has 219939 Blast hits to 80042 proteins in 2746 species: Archae - 655%3B Bacteria - 50351%3B Metazoa - 79801%3B Fungi - 26960%3B Plants - 28532%3B Viruses - 6737%3B Other Eukaryotes - 26903 (source: NCBI BLink).;Dbxref=PMID:12177459,PMID:12169696,PMID:12481097,PMID:12805589,PMID:15047898,PMID:15634197,PMID:15516340,PMID:15824099,PMID:15978049,PMID:16284307,PMID:16367964,PMID:16553894,PMID:17059410,PMID:17149585,PMID:17704230,locus:2127460;locus_type=protein_coding","","","protease inhibitor/seed storage/lipid transfer protein (LTP) family protein","","",4,"m_4_11631139",0.0273593045059114,0.0239373212467941,3.82665008178059,"m_4_11123050","m_4_11979842",4,11123050,11979842
"AT4G22485",556498,"Chr4","Araport11","gene",11844506,11846476,".","-",".","ID=AT4G22485;Name=AT4G22485;Note=Bifunctional inhibitor/lipid-transfer protein/seed storage 2S albumin superfamily protein;curator_summary=Encodes a Protease inhibitor/seed storage/LTP family protein;computational_description=Bifunctional inhibitor/lipid-transfer protein/seed storage 2S albumin superfamily protein%3B FUNCTIONS IN: molecular_function unknown%3B INVOLVED IN: lipid transport%3B LOCATED IN: cellular_component unknown%3B EXPRESSED IN: sperm cell%3B CONTAINS InterPro DOMAIN/s: Bifunctional inhibitor/plant lipid transfer protein/seed storage (InterPro:IPR016140)%2C Plant lipid transfer protein/hydrophobic protein%2C helical domain (InterPro:IPR013770)%3B BEST Arabidopsis thaliana protein match is: protease inhibitor/seed storage/lipid transfer protein (LTP) family protein (TAIR:AT4G22470.1)%3B Has 30201 Blast hits to 17322 proteins in 780 species: Archae - 12%3B Bacteria - 1396%3B Metazoa - 17338%3B Fungi - 3422%3B Plants - 5037%3B Viruses - 0%3B Other Eukaryotes - 2996 (source: NCBI BLink).;Dbxref=locus:4010713901;locus_type=protein_coding","","","Bifunctional inhibitor/lipid-transfer protein/seed storage 2S albumin superfamily protein","","Encodes a Protease inhibitor/seed storage/LTP family protein",4,"m_4_11631139",0.0273593045059114,0.0239373212467941,3.82665008178059,"m_4_11123050","m_4_11979842",4,11123050,11979842
"AT4G32280",586006,"Chr4","Araport11","gene",15583332,15584903,".","+",".","ID=AT4G32280;Name=AT4G32280;Note=indole-3-acetic acid inducible 29;curator_summary=Auxin inducible protein.;symbol=IAA29;full_name=indole-3-acetic acid inducible 29;computational_description=indole-3-acetic acid inducible 29 (IAA29)%3B FUNCTIONS IN: sequence-specific DNA binding transcription factor activity%3B INVOLVED IN: response to auxin stimulus%2C response to cyclopentenone%2C response to red light%2C response to far red light%3B LOCATED IN: nucleus%3B EXPRESSED IN: 7 plant structures%3B EXPRESSED DURING: 6 growth stages%3B CONTAINS InterPro DOMAIN/s: Aux/IAA-ARF-dimerisation (InterPro:IPR011525)%2C AUX/IAA protein (InterPro:IPR003311)%3B BEST Arabidopsis thaliana protein match is: indoleacetic acid-induced protein 10 (TAIR:AT1G04100.1)%3B Has 30201 Blast hits to 17322 proteins in 780 species: Archae - 12%3B Bacteria - 1396%3B Metazoa - 17338%3B Fungi - 3422%3B Plants - 5037%3B Viruses - 0%3B Other Eukaryotes - 2996 (source: NCBI BLink).;Dbxref=PMID:11118137,PMID:12036262,PMID:15247399,PMID:12893885,PMID:16243906,PMID:16284307,PMID:16489122,PMID:16901781,PMID:17076805,PMID:17435085,PMID:17885085,PMID:18334669,PMID:19249207,PMID:21666227,PMID:23037004,PMID:23037003,PMID:23629833,PMID:23757399,PMID:24424094,locus:2116505;locus_type=protein_coding","","indole-3-acetic acid inducible 29","indole-3-acetic acid inducible 29","IAA29","Auxin inducible protein.",4,"m_4_16212324",0.0199087693610844,0.0200034033792873,4.53245590601303,"m_4_15488750","m_4_16640333",4,15488750,16640333
"AT4G32290",586052,"Chr4","Araport11","gene",15589434,15591213,".","-",".","ID=AT4G32290;Name=AT4G32290;Note=Core-2/I-branching beta-1%2C6-N-acetylglucosaminyltransferase family protein;computational_description=Core-2/I-branching beta-1%2C6-N-acetylglucosaminyltransferase family protein%3B FUNCTIONS IN: molecular_function unknown%3B INVOLVED IN: biological_process unknown%3B LOCATED IN: endomembrane system%3B EXPRESSED IN: 22 plant structures%3B EXPRESSED DURING: 13 growth stages%3B CONTAINS InterPro DOMAIN/s: Core-2/I-Branching enzyme (InterPro:IPR021141)%3B BEST Arabidopsis thaliana protein match is: Core-2/I-branching beta-1%2C6-N-acetylglucosaminyltransferase family protein (TAIR:AT5G25330.1)%3B Has 1807 Blast hits to 1807 proteins in 277 species: Archae - 0%3B Bacteria - 0%3B Metazoa - 736%3B Fungi - 347%3B Plants - 385%3B Viruses - 0%3B Other Eukaryotes - 339 (source: NCBI BLink).;Dbxref=locus:2116515;locus_type=protein_coding","","","Core-2/I-branching beta-1%2C6-N-acetylglucosaminyltransferase family protein","","",4,"m_4_16212324",0.0199087693610844,0.0200034033792873,4.53245590601303,"m_4_15488750","m_4_16640333",4,15488750,16640333
"AT4G32540",586989,"Chr4","Araport11","gene",15700829,15703000,".","+",".","ID=AT4G32540;Name=AT4G32540;Note=Flavin-binding monooxygenase family protein;curator_summary=Mutant has elevated levels of free IAA in dominant mutant allele%3B Flavin Monooxygenase-Like Enzyme%3B Auxin Biosynthesis;symbol=YUC1;Alias=YUC,YUCCA;full_name=YUCCA 1;computational_description=YUCCA 1 (YUC1)%3B FUNCTIONS IN: NADP or NADPH binding%2C oxidoreductase activity%2C FAD binding%2C flavin-containing monooxygenase activity%3B INVOLVED IN: in 7 processes%3B EXPRESSED IN: 12 plant structures%3B EXPRESSED DURING: C globular stage%2C F mature embryo stage%2C petal differentiation and expansion stage%2C E expanded cotyledon stage%2C D bilateral stage%3B CONTAINS InterPro DOMAIN/s: Pyridine nucleotide-disulphide oxidoreductase%2C class-II (InterPro:IPR000103)%2C FAD-dependent pyridine nucleotide-disulphide oxidoreductase (InterPro:IPR013027)%2C Flavin-containing monooxygenase-like (InterPro:IPR020946)%3B BEST Arabidopsis thaliana protein match is: Flavin-binding monooxygenase family protein (TAIR:AT5G11320.1)%3B Has 1807 Blast hits to 1807 proteins in 277 species: Archae - 0%3B Bacteria - 0%3B Metazoa - 736%3B Fungi - 347%3B Plants - 385%3B Viruses - 0%3B Other Eukaryotes - 339 (source: NCBI BLink).;Dbxref=PMID:11914280,PMID:11209081,PMID:12464638,PMID:16126863,PMID:16818609,PMID:16905669,PMID:17704214,PMID:17919906,PMID:18000043,PMID:18799737,PMID:19075219,PMID:19154004,PMID:19223973,PMID:19306104,PMID:19279202,PMID:19525324,PMID:19710233,PMID:19820306,PMID:19995721,PMID:20237017,PMID:20421476,PMID:20974893,PMID:21051957,PMID:21205174,PMID:21511905,PMID:22025724,PMID:22025721,PMID:22108406,PMID:21251106,PMID:22995285,PMID:23271028,PMID:23521356,PMID:23722561,PMID:23840182,PMID:24398922,PMID:24595288,PMID:23776189,locus:2131322;locus_type=protein_coding","YUC,YUCCA","YUCCA 1","Flavin-binding monooxygenase family protein","YUC1","Mutant has elevated levels of free IAA in dominant mutant allele%3B Flavin Monooxygenase-Like Enzyme%3B Auxin Biosynthesis",4,"m_4_16212324",0.0199087693610844,0.0200034033792873,4.53245590601303,"m_4_15488750","m_4_16640333",4,15488750,16640333
"AT4G33400",590601,"Chr4","Araport11","gene",16077898,16080721,".","-",".","ID=AT4G33400;Name=AT4G33400;Note=Vacuolar import/degradation%2C Vid27-related protein;computational_description=Vacuolar import/degradation%2C Vid27-related protein%3B FUNCTIONS IN: molecular_function unknown%3B INVOLVED IN: N-terminal protein myristoylation%3B LOCATED IN: cytosol%2C nucleus%2C plasma membrane%3B EXPRESSED IN: 25 plant structures%3B EXPRESSED DURING: 15 growth stages%3B CONTAINS InterPro DOMAIN/s: WD40 repeat-like-containing domain (InterPro:IPR011046)%2C Vacuolar import/degradation%2C Vid27-related (InterPro:IPR013863)%3B BEST Arabidopsis thaliana protein match is: Vacuolar import/degradation%2C Vid27-related protein (TAIR:AT3G19240.1)%3B Has 271 Blast hits to 271 proteins in 130 species: Archae - 0%3B Bacteria - 0%3B Metazoa - 6%3B Fungi - 139%3B Plants - 79%3B Viruses - 0%3B Other Eukaryotes - 47 (source: NCBI BLink).;Dbxref=PMID:12169696,PMID:12912986,PMID:15937229,PMID:17329565,PMID:17827350,PMID:18433157,PMID:18775970,locus:2119221;locus_type=protein_coding","","","Vacuolar import/degradation%2C Vid27-related protein","","",4,"m_4_16212324",0.0199087693610844,0.0200034033792873,4.53245590601303,"m_4_15488750","m_4_16640333",4,15488750,16640333
"AT4G34000",592305,"Chr4","Araport11","gene",16295334,16298285,".","+",".","ID=AT4G34000;Name=AT4G34000;Note=abscisic acid responsive elements-binding factor 3;curator_summary=Encodes an ABA-responsive element-binding protein with similarity to transcription factors that is expressed in response to stress and abscisic acid.;symbol=ABF3;Alias=AtABF3,DPBF5,DC3 PROMOTER-BINDING FACTOR 5;full_name=abscisic acid responsive elements-binding factor 3;computational_description=abscisic acid responsive elements-binding factor 3 (ABF3)%3B FUNCTIONS IN: protein binding%2C DNA binding%2C transcription activator activity%2C sequence-specific DNA binding transcription factor activity%3B INVOLVED IN: in 6 processes%3B EXPRESSED IN: 23 plant structures%3B EXPRESSED DURING: 12 growth stages%3B CONTAINS InterPro DOMAIN/s: Basic-leucine zipper (bZIP) transcription factor (InterPro:IPR004827)%2C bZIP transcription factor%2C bZIP-1 (InterPro:IPR011616)%3B BEST Arabidopsis thaliana protein match is: ABRE binding factor 4 (TAIR:AT3G19290.1)%3B Has 2159 Blast hits to 2007 proteins in 161 species: Archae - 0%3B Bacteria - 4%3B Metazoa - 512%3B Fungi - 34%3B Plants - 1491%3B Viruses - 0%3B Other Eukaryotes - 118 (source: NCBI BLink).;Dbxref=PMID:10760247,PMID:10636868,PMID:11019812,PMID:11118137,PMID:11906833,PMID:12376636,PMID:16258012,PMID:16299177,PMID:16463099,PMID:16247556,PMID:19895399,PMID:20105335,PMID:20733066,PMID:20852918,PMID:19947981,PMID:21085673,PMID:21471120,PMID:22025559,PMID:22140235,PMID:22350156,PMID:23742014,PMID:24078097,PMID:24285786,PMID:24475264,PMID:24350984,PMID:24561249,PMID:24518068,PMID:24483851,PMID:24738645,PMID:25234727,PMID:25616872,locus:2118969;locus_type=protein_coding","AtABF3,DPBF5,DC3 PROMOTER-BINDING FACTOR 5","abscisic acid responsive elements-binding factor 3","abscisic acid responsive elements-binding factor 3","ABF3","Encodes an ABA-responsive element-binding protein with similarity to transcription factors that is expressed in response to stress and abscisic acid.",4,"m_4_16212324",0.0199087693610844,0.0200034033792873,4.53245590601303,"m_4_15488750","m_4_16640333",4,15488750,16640333
"AT4G34590",594334,"Chr4","Araport11","gene",16521861,16523230,".","+",".","ID=AT4G34590;Name=AT4G34590;Note=G-box binding factor 6;curator_summary=Encodes a basic domain leucine zipper (bZip) transcription factor bZIP11. Translation is repressed by sucrose. Directly regulates gene expression of ASN1 and ProDH2%2C which are enzyme-coding genes involved in amino acid metabolism.;symbol=GBF6;Alias=ATB2,AtbZIP11,Arabidopsis thaliana basic leucine-zipper 11,BZIP11;full_name=G-box binding factor 6;computational_description=G-box binding factor 6 (GBF6)%3B FUNCTIONS IN: DNA binding%2C protein heterodimerization activity%2C sequence-specific DNA binding transcription factor activity%3B INVOLVED IN: sucrose induced translational repression%2C negative regulation of translation%2C regulation of transcription%2C DNA-dependent%2C response to sucrose stimulus%3B LOCATED IN: chloroplast%3B CONTAINS InterPro DOMAIN/s: Basic-leucine zipper (bZIP) transcription factor (InterPro:IPR004827)%2C bZIP transcription factor%2C bZIP-1 (InterPro:IPR011616)%3B BEST Arabidopsis thaliana protein match is: basic leucine-zipper 44 (TAIR:AT1G75390.1)%3B Has 1778 Blast hits to 1778 proteins in 91 species: Archae - 0%3B Bacteria - 0%3B Metazoa - 8%3B Fungi - 2%3B Plants - 1730%3B Viruses - 0%3B Other Eukaryotes - 38 (source: NCBI BLink).;Dbxref=PMID:9721683,PMID:9620274,PMID:11118137,PMID:11906833,PMID:15047879,PMID:15208401,PMID:15667324,PMID:15548739,PMID:16709202,PMID:18088315,PMID:18231654,PMID:19403731,PMID:19376782,PMID:20179149,PMID:20799971,PMID:21534971,PMID:21753116,PMID:21889051,PMID:22253603,PMID:22457737,PMID:23461773,PMID:23735508,PMID:24861440,locus:2139584;locus_type=protein_coding","ATB2,AtbZIP11,Arabidopsis thaliana basic leucine-zipper 11,BZIP11","G-box binding factor 6","G-box binding factor 6","GBF6","Encodes a basic domain leucine zipper (bZip) transcription factor bZIP11. Translation is repressed by sucrose. Directly regulates gene expression of ASN1 and ProDH2%2C which are enzyme-coding genes involved in amino acid metabolism.",4,"m_4_16212324",0.0199087693610844,0.0200034033792873,4.53245590601303,"m_4_15488750","m_4_16640333",4,15488750,16640333
"AT4G34710",594636,"Chr4","Araport11","gene",16560030,16563044,".","-",".","ID=AT4G34710;Name=AT4G34710;Note=arginine decarboxylase 2;curator_summary=encodes a arginine decarboxylase (ADC)%2C a rate-limiting enzyme that catalyzes the first step of polyamine (PA) biosynthesis via ADC pathway in Arabidopsis thaliana. Arabidopsis genome has two ADC paralogs%2C ADC1 and ADC2. ADC2 is stress-inducible (osmotic stress). Double mutant analysis showed that ADC genes are essential for the production of PA%2C and are required for normal seed development. Overexpression causes phenotypes similar to GA-deficient plants and these plants show reduced levels of GA due to lower expression levels of AtGA20ox1%2C AtGA3ox3 and AtGA3ox1.;symbol=ADC2;Alias=ATADC2,SPE2;full_name=arginine decarboxylase 2;computational_description=arginine decarboxylase 2 (ADC2)%3B CONTAINS InterPro DOMAIN/s: Orn/DAP/Arg decarboxylase 2%2C C-terminal (InterPro:IPR022643)%2C Orn/DAP/Arg decarboxylase 2%2C conserved site (InterPro:IPR022657)%2C Orn/DAP/Arg decarboxylase 2%2C pyridoxal-phosphate binding site (InterPro:IPR022653)%2C Ornithine/DAP/Arg decarboxylase (InterPro:IPR000183)%2C Arginine decarboxylase (InterPro:IPR002985)%2C Orn/DAP/Arg decarboxylase 2%2C N-terminal (InterPro:IPR022644)%3B BEST Arabidopsis thaliana protein match is: arginine decarboxylase 1 (TAIR:AT2G16500.1)%3B Has 7853 Blast hits to 7777 proteins in 2122 species: Archae - 112%3B Bacteria - 5255%3B Metazoa - 102%3B Fungi - 32%3B Plants - 645%3B Viruses - 2%3B Other Eukaryotes - 1705 (source: NCBI BLink).;Dbxref=PMID:10481069,PMID:9787437,PMID:9680979,PMID:11576438,PMID:11351099,PMID:12111553,PMID:12428010,PMID:14684170,PMID:15086823,PMID:15347784,PMID:15634198,PMID:15733873,PMID:16045477,PMID:18375607,PMID:18701673,PMID:18775970,PMID:19054359,PMID:19303315,PMID:20351290,PMID:20206537,PMID:23080295,PMID:25409942,locus:2139629;locus_type=protein_coding","ATADC2,SPE2","arginine decarboxylase 2","arginine decarboxylase 2","ADC2","encodes a arginine decarboxylase (ADC)%2C a rate-limiting enzyme that catalyzes the first step of polyamine (PA) biosynthesis via ADC pathway in Arabidopsis thaliana. Arabidopsis genome has two ADC paralogs%2C ADC1 and ADC2. ADC2 is stress-inducible (osmotic stress). Double mutant analysis showed that ADC genes are essential for the production of PA%2C and are required for normal seed development. Overexpression causes phenotypes similar to GA-deficient plants and these plants show reduced levels of GA due to lower expression levels of AtGA20ox1%2C AtGA3ox3 and AtGA3ox1.",4,"m_4_16212324",0.0199087693610844,0.0200034033792873,4.53245590601303,"m_4_15488750","m_4_16640333",4,15488750,16640333
"AT4G34770",594748,"Chr4","Araport11","gene",16591179,16591910,".","+",".","ID=AT4G34770;Name=AT4G34770;Note=SAUR-like auxin-responsive protein family;Alias=SAUR1,SMALL AUXIN UPREGULATED RNA 1;computational_description=SAUR-like auxin-responsive protein family %3B CONTAINS InterPro DOMAIN/s: Auxin responsive SAUR protein (InterPro:IPR003676)%3B BEST Arabidopsis thaliana protein match is: SAUR-like auxin-responsive protein family  (TAIR:AT2G21210.1)%3B Has 1411 Blast hits to 1394 proteins in 28 species: Archae - 0%3B Bacteria - 0%3B Metazoa - 0%3B Fungi - 0%3B Plants - 1410%3B Viruses - 0%3B Other Eukaryotes - 1 (source: NCBI BLink).;Dbxref=PMID:15047898,PMID:15489341,PMID:16214899,PMID:16412086,PMID:16901781,PMID:17435085,locus:2116860;locus_type=protein_coding","SAUR1,SMALL AUXIN UPREGULATED RNA 1","","SAUR-like auxin-responsive protein family","","",4,"m_4_16212324",0.0199087693610844,0.0200034033792873,4.53245590601303,"m_4_15488750","m_4_16640333",4,15488750,16640333
"AT5G41400",712607,"Chr5","Araport11","gene",16569375,16570275,".","-",".","ID=AT5G41400;Name=AT5G41400;Note=RING/U-box superfamily protein;computational_description=RING/U-box superfamily protein%3B FUNCTIONS IN: zinc ion binding%3B LOCATED IN: endomembrane system%3B EXPRESSED IN: 17 plant structures%3B EXPRESSED DURING: 8 growth stages%3B CONTAINS InterPro DOMAIN/s: Zinc finger%2C RING-type (InterPro:IPR001841)%2C Zinc finger%2C C3HC4 RING-type (InterPro:IPR018957)%3B BEST Arabidopsis thaliana protein match is: RING/U-box superfamily protein (TAIR:AT1G63840.1)%3B Has 1807 Blast hits to 1807 proteins in 277 species: Archae - 0%3B Bacteria - 0%3B Metazoa - 736%3B Fungi - 347%3B Plants - 385%3B Viruses - 0%3B Other Eukaryotes - 339 (source: NCBI BLink).;Dbxref=PMID:11983057,PMID:16258011,PMID:16792696,PMID:17227549,PMID:18424613,PMID:18650403,locus:2177931;locus_type=protein_coding","","","RING/U-box superfamily protein","","",5,"m_5_16608188",0.0122772470847006,0.0148031482111097,3.76657196772971,"m_5_15992711","m_5_17827922",5,15992711,17827922
